{
  "notification_id": "NTF_DELIV_8801",
  "farmer_id": "FARMER_101",
  "category": "DISEASE_ALERT",
  "title": "🔔 Yellow Rust Warning",
  "message": "Field Agent Rahul confirmed early symptoms on plot A-2. Approved treatment guidance is now unlocked.",
  "delivery_status": "DELIVERED",
  "channel": "IN_APP_DASHBOARD",
  "retry_count": 0,
  "created_at": "2026-09-04T14:46:00Z",
  "sent_at": "2026-09-04T14:46:01Z",
  "delivered_at": "2026-09-04T14:46:02Z",
  "read_at": null
}

